<?xml version="1.0" encoding="utf-8" standalone="no"?>
<jobcase
    xmlns:xsi="http://www.w3.org/2001/XMLSchema-instance"
    xsi:noNamespaceSchemaLocation="jobtest.xsd"
    enabled="false"
    >
    <click>

        <indexView
            indexs="5"
            resId="com.job.android:id/home_page_gridview"
            rootClass="android.widget.GridView" />
    </click>

    <swipe>

        <text
            resId="com.job.android:id/content_layout"
            swipeDirection="left" />
    </swipe>

    <click>

        <text resId="com.job.android:id/goback" />
    </click>

    <click>

        <indexView
            indexs="5"
            resId="com.job.android:id/home_page_gridview"
            rootClass="android.widget.GridView" />
    </click>

    <swipe>

        <text
            resId="com.job.android:id/flipView"
            swipeDirection="left" />
    </swipe>

    <swipe>

        <text
            resId="com.job.android:id/flipView"
            swipeDirection="left" />
    </swipe>

    <click>

        <indexView
            indexs="4"
            resId="com.job.android:id/resume_home_gridview"
            rootClass="android.widget.GridView" />
    </click>

    <click>

        <indexView
            indexs="2"
            rootClass="android.widget.ListView"
            rootResId="com.job.android:id/dlv_operation_select" />
    </click>

    <click>

        <text resId="com.job.android:id/content_layout" />
    </click>

    <click> <!-- unknown attrribute : MonkeyTalkEvent [mComponent=Scroller, mMonkeyID=#4, mAction=tap, mArgument=null, mTimeout=0, mThinkTime=0, mShouldFailed=false] -->

        <text unknown="#4" />
    </click>

    <click>
        <text text="修改名称" />
    </click>

    <input>

        <text
            text="请输入简历名称"
            typed="ummaryffd" />
    </input>

    <swipe>

        <text
            swipeDirection="right"
            text="保存" />
    </swipe>

    <click>

        <text resId="com.job.android:id/goback" />
    </click>

</jobcase>