<?xml version="1.0" encoding="utf-8"?>
<jobcase
 	xmlns:xsi="http://www.w3.org/2001/XMLSchema-instance"
    xsi:noNamespaceSchemaLocation="jobtest.xsd"
    enabled="false"
    >
    <click>
    	<text>"登录"</text>
    	<text>"注册"</text>        
    	<text>"手机号注册"</text>
    </click>
    <input>
        <text
            typed="#"
            text="请输入手机号"
            />
        <text
            typed="121212"
            text="请输入验证码"
            />
    </input>
    <click>
        <text>"获取验证码"</text>
    </click>
    <record condition="view_not_exist">
        <text>"uuid为空"</text>
    </record>
</jobcase>